{
  "schemaId": "cd-collab.log_workbench_bookmark.v1",
  "id": "44444444-4444-4444-8444-444444444444",
  "investigationId": "11111111-1111-4111-8111-111111111111",
  "locator": {
    "evidenceId": "22222222-2222-4222-8222-222222222222",
    "digestAtBind": "aaaaaaaaaaaaaaaaaaaaaaaaaaaaaaaaaaaaaaaaaaaaaaaaaaaaaaaaaaaaaaaa",
    "byteOffset": 12,
    "lineNumber": 3,
    "originalTimestamp": "2024-03-10 02:30:00",
    "normalizedUtc": null,
    "corpusRevision": 3
  },
  "shareSafeToken": "c16dd923801ee7cf7db4bd342facea488f4f48aa6efb64557499785e0b0ad7bd",
  "note": "DST gap line — do not treat as an instant.",
  "status": "resolved",
  "staleReason": null,
  "privacyClass": "owner_only",
  "idempotencyKey": "bookmark-gap-0001",
  "createdAt": "2024-03-11T12:05:00.000Z",
  "createdBy": "analyst-synthetic-01",
  "replayed": false
}
